{
  "schema": "knowledge-hub.product.knowledgeos-v01-rc-corpus-scale-answer-quality-gate-refresh-after-positive-answer-execution.v1",
  "status": "ready",
  "generatedAt": "2026-05-30T03:25:16Z",
  "decision": "knowledgeos_v01_rc_corpus_scale_answer_quality_gate_refresh_after_positive_answer_execution_ready",
  "nextRecommendedTranche": "knowledgeos_v01_rc_positive_section_paragraph_quality_complete_review",
  "inputs": {
    "positiveExecutionReportRef": "eval/knowledgeos/reports/knowledgeos_v01_rc_corpus_scale_answer_quality_positive_answer_execution_gate.v1.json",
    "corpusManifestRef": "eval/knowledgeos/fixtures/corpus_manifest.json",
    "papersDirRef": "papers_dir"
  },
  "policy": {
    "labsInternalOnly": true,
    "reportOnly": true,
    "localFakeLlmOnly": true,
    "externalModelCallsAllowed": false,
    "judgeModelCallsAllowed": false,
    "answerStyleJudged": false,
    "answerTextExcludedFromReport": true,
    "answerContractRawCitationPayloadExcluded": true,
    "sourcePayloadExcludedFromReport": true,
    "excerptExcludedFromReport": true,
    "publicDefaultPromotionAllowed": false,
    "tableEquationFigurePromotionAllowed": false
  },
  "qualityDimensions": [
    "answer_payload_status_ok",
    "evidence_packet_contract_present",
    "answer_contract_present",
    "source_coverage",
    "source_hash_coverage",
    "chars_locator_coverage",
    "answer_contract_citation_provenance",
    "public_default_held"
  ],
  "counts": {
    "qualityGateRefreshRows": 1,
    "inputPositiveExecutionReportRows": 1,
    "positiveExecutionReadyInputRows": 1,
    "inputPositiveExecutionRows": 7,
    "attemptedProvenanceRows": 7,
    "provenancePassRows": 7,
    "provenanceFailRows": 0,
    "positiveSectionParagraphQualityCompleteRows": 1,
    "positiveMethodComparisonRows": 3,
    "positiveLimitationRows": 4,
    "heldExpectedNoAnswerRows": 17,
    "heldStructuredModalityRows": 34,
    "controlledExecutionUnexpectedAnswerableRows": 0,
    "controlledExecutionNoAnswerSafetyFailRows": 0,
    "sourceCoveragePassRows": 7,
    "sourceHashCoveragePassRows": 7,
    "charsLocatorCoveragePassRows": 7,
    "answerContractCitationProvenancePassRows": 7,
    "averageQualityScore": 1.0,
    "minQualityScore": 1.0,
    "evidencePacketContractSpanRows": 20,
    "strictProvenanceSpanRows": 20,
    "sourceContentHashRows": 20,
    "charsLocatorRows": 20,
    "answerContractCitationRows": 20,
    "answerContractCitationProvenanceRows": 20,
    "localFakeLlmCallRows": 7,
    "liveAnswerExecutionRows": 7,
    "answerPathInvokedRows": 7,
    "answerQualityMeasuredRows": 7,
    "answerQualityScoreComputedRows": 7,
    "publicDefaultPromotionReadyRows": 0,
    "publicDefaultPromotionHeldRows": 1,
    "generalRcReadyRows": 0,
    "blockedRows": 0,
    "candidateStoreWriteRows": 0,
    "sourceSpanCreatedRows": 0,
    "strictEvidenceRows": 0,
    "citationGradeEvidenceRows": 0,
    "runtimeEvidenceRows": 0,
    "parserExecutionRows": 0,
    "databaseMutationRows": 0,
    "indexMutationRows": 0,
    "reindexOrReembedRows": 0,
    "canonicalParsedArtifactWriteRows": 0,
    "vaultScanRows": 0,
    "externalDownloadRows": 0,
    "publicCliFlagRows": 0,
    "defaultOnRows": 0,
    "externalLlmCallRows": 0,
    "modelApiCallRows": 0,
    "judgeModelCallRows": 0,
    "githubPrMutationRows": 0,
    "mergeRows": 0,
    "branchDeletionRows": 0,
    "releaseTagRows": 0,
    "packagePublishRows": 0,
    "rawPayloadPersistedRows": 0,
    "defaultMcpToolRows": 0,
    "defaultKhubAskRouteRows": 0,
    "privatePathLeakRows": 0,
    "schemaViolationCount": 0
  },
  "gate": {
    "qualityGateRefreshReady": true,
    "positiveExecutionReady": true,
    "noAnswerSafetyStillGreen": true,
    "allPositiveProvenancePassed": true,
    "positiveSectionParagraphQualityComplete": true,
    "expectedNoAnswerRowsHeld": true,
    "structuredModalityRowsHeld": true,
    "publicDefaultPromotionAllowed": false,
    "generalRcReady": false,
    "semanticViolations": []
  },
  "provenanceRows": [
    {
      "caseIndex": 28,
      "caseId": "complex-paper-qa-seed-20260520-q028",
      "questionCategory": "method_comparison_qa",
      "paperIds": [
        "2404.16130",
        "2410.05779"
      ],
      "questionSha256": "d3eadeb13475e28c765b25292eab3b8f62bfee2e8bf7e7eeccd3bdbc4ca974da",
      "observedStatus": "ok",
      "localFakeLlmCallRows": 1,
      "observedSourceIds": [
        "2404.16130",
        "2410.05779"
      ],
      "missingSourceIds": [],
      "minRequiredProvenanceRows": 4,
      "evidencePacketContractSpanRows": 4,
      "strictProvenanceSpanRows": 4,
      "sourceContentHashRows": 4,
      "charsLocatorRows": 4,
      "answerContractCitationRows": 4,
      "answerContractCitationProvenanceRows": 4,
      "dimensionStatuses": {
        "answerPayloadStatusOk": true,
        "evidencePacketContractPresent": true,
        "answerContractPresent": true,
        "sourceCoverage": true,
        "sourceHashCoverage": true,
        "charsLocatorCoverage": true,
        "answerContractCitationProvenance": true,
        "publicDefaultHeld": true
      },
      "qualityScore": 1.0,
      "qualityGrade": "pass",
      "pass": true,
      "spanProofRows": [
        {
          "spanRef": "span:1",
          "sourceId": "2404.16130",
          "sourceRef": "papers_dir/parsed/2404.16130/document.md",
          "sourceContentHash": "sha256:730f1a9f38d16689900969a3eeeb1b31e45eda1dcc1f37a043afa90aff76c867",
          "sourceContentHashAvailable": true,
          "spanLocator": "chars:25-1425",
          "spanOffsetAvailable": true,
          "charStart": 25,
          "charEnd": 1425,
          "evidenceKind": "parsed_artifact_evidence_chunk",
          "candidateRecordId": "parsed-artifact-evidence-chunk-candidate:2404.16130:paragraph:8b9c151c5805a20e",
          "candidateStoreRef": "papers_dir/structured_evidence_candidates/evidence_chunk/2404.16130.jsonl",
          "strictProvenance": true,
          "excerptIncludedInReport": false
        },
        {
          "spanRef": "span:2",
          "sourceId": "2404.16130",
          "sourceRef": "papers_dir/parsed/2404.16130/document.md",
          "sourceContentHash": "sha256:730f1a9f38d16689900969a3eeeb1b31e45eda1dcc1f37a043afa90aff76c867",
          "sourceContentHashAvailable": true,
          "spanLocator": "chars:2630-4030",
          "spanOffsetAvailable": true,
          "charStart": 2630,
          "charEnd": 4030,
          "evidenceKind": "parsed_artifact_evidence_chunk",
          "candidateRecordId": "parsed-artifact-evidence-chunk-candidate:2404.16130:paragraph:932852be4aa1931e",
          "candidateStoreRef": "papers_dir/structured_evidence_candidates/evidence_chunk/2404.16130.jsonl",
          "strictProvenance": true,
          "excerptIncludedInReport": false
        },
        {
          "spanRef": "span:3",
          "sourceId": "2410.05779",
          "sourceRef": "papers_dir/parsed/2410.05779/document.md",
          "sourceContentHash": "sha256:bd72eebf611df1366b251c16ce4eac7aac699e519783c586feb2c5c43899347a",
          "sourceContentHashAvailable": true,
          "spanLocator": "chars:25-1425",
          "spanOffsetAvailable": true,
          "charStart": 25,
          "charEnd": 1425,
          "evidenceKind": "parsed_artifact_evidence_chunk",
          "candidateRecordId": "parsed-artifact-evidence-chunk-candidate:2410.05779:paragraph:bff10dbf445c55ea",
          "candidateStoreRef": "papers_dir/structured_evidence_candidates/evidence_chunk/2410.05779.jsonl",
          "strictProvenance": true,
          "excerptIncludedInReport": false
        },
        {
          "spanRef": "span:4",
          "sourceId": "2410.05779",
          "sourceRef": "papers_dir/parsed/2410.05779/document.md",
          "sourceContentHash": "sha256:bd72eebf611df1366b251c16ce4eac7aac699e519783c586feb2c5c43899347a",
          "sourceContentHashAvailable": true,
          "spanLocator": "chars:3822-5222",
          "spanOffsetAvailable": true,
          "charStart": 3822,
          "charEnd": 5222,
          "evidenceKind": "parsed_artifact_evidence_chunk",
          "candidateRecordId": "parsed-artifact-evidence-chunk-candidate:2410.05779:paragraph:57d38336632ac576",
          "candidateStoreRef": "papers_dir/structured_evidence_candidates/evidence_chunk/2410.05779.jsonl",
          "strictProvenance": true,
          "excerptIncludedInReport": false
        }
      ],
      "answerTextIncludedInReport": false,
      "citationPayloadIncludedInReport": false,
      "sourcePayloadIncludedInReport": false,
      "excerptIncludedInReport": false,
      "failureReasons": []
    },
    {
      "caseIndex": 29,
      "caseId": "complex-paper-qa-seed-20260520-q029",
      "questionCategory": "method_comparison_qa",
      "paperIds": [
        "1706.03762",
        "2312.00752"
      ],
      "questionSha256": "f7b3f9f4517adba395bde22bb76b9bf263788e881c8203dfb95921f5c427e202",
      "observedStatus": "ok",
      "localFakeLlmCallRows": 1,
      "observedSourceIds": [
        "1706.03762",
        "2312.00752"
      ],
      "missingSourceIds": [],
      "minRequiredProvenanceRows": 4,
      "evidencePacketContractSpanRows": 4,
      "strictProvenanceSpanRows": 4,
      "sourceContentHashRows": 4,
      "charsLocatorRows": 4,
      "answerContractCitationRows": 4,
      "answerContractCitationProvenanceRows": 4,
      "dimensionStatuses": {
        "answerPayloadStatusOk": true,
        "evidencePacketContractPresent": true,
        "answerContractPresent": true,
        "sourceCoverage": true,
        "sourceHashCoverage": true,
        "charsLocatorCoverage": true,
        "answerContractCitationProvenance": true,
        "publicDefaultHeld": true
      },
      "qualityScore": 1.0,
      "qualityGrade": "pass",
      "pass": true,
      "spanProofRows": [
        {
          "spanRef": "span:1",
          "sourceId": "1706.03762",
          "sourceRef": "papers_dir/parsed/1706.03762/document.md",